title,url,year,entities,temperature,color,x,y,cluster
AI is dreaming up drugs that no one has ever seen. Now we’ve got to see if they work.,https://www.technologyreview.com/2023/02/15/1067904/ai-automation-drug-development/,2023,"['AI', 'Merck', 'Luisa Salter-Cid', 'Google DeepMind', 'Verseon', 'Pioneering Medicines', 'Insilico Medicine', 'Washington', 'the University of Washington', 'ChatGPT', 'Abu Dhabi', 'Novartis', 'Austria', 'Cambridge', 'the Medical University of Vienna', 'UK', 'MIT Technology Review', 'Generate Biomedicines', 'Vancouver', 'Nathan Benaich', 'Richard Law', 'Vienna', 'Prakash', 'AstraZeneca', 'Big Pharma', 'Exscientia', 'Flagship Pioneering', 'OpenAI', 'Massachusetts', 'Andrew Hopkins', 'Lovisa Afzelius', 'California', 'Johnson & Johnson', 'Apriori Bio', 'Sean McClain', 'Adityo Prakash', 'David Baker', 'Salter-Cid', 'Hong Kong', 'Hopkins', 'Jim Weatherall']",1,#5500aa,494.8051948051951,463.63636363636385,p_11
Inside the ChatGPT race in China,https://www.technologyreview.com/2023/02/15/1068624/chatgpt-race-china-baidu-ai/,2023,"['New York', 'AI', 'CNN', 'iFlytek', 'JD.com', 'GPT-3', 'Baidu', 'Wang Huiwen', 'Douyin', 'Huawei', 'Alibaba', 'the United States’', 'China Entrepreneur', 'Jeffrey Ding', 'PanGu-Alpha', 'Synthesia', 'ChatGPT', 'DAMO Academy', 'China', 'Shanghai', 'India', 'MIT Technology Review', 'Sam Altman', 'New York Times', 'Meituan', 'Reuters', 'the US Department of Commerce', 'ByteDance', 'Wall Street Journal', 'Nvidia', 'Financial Times', 'OpenAI', 'Russia', 'TikTok', 'Microsoft', 'NetEase', 'UN', 'Hu Xijin', 'US', 'DiDi', 'George Washington University', 'the Global Times', 'Bloomberg $', 'NPR']",1,#5500aa,453.2467532467535,131.1688311688312,p_1
Out with the old and in with the “new IT”,https://www.technologyreview.com/2023/02/08/1067218/out-with-the-old-and-in-with-the-new-it/,2023,"['Yong: Laurel', 'GPU', 'MIT', 'AI', 'PUE', 'Global CTO Study', 'the Society of Photographic Instrumentation Engineers', 'the International Association for Pattern Recognition', 'LAPS', 'AIOps', 'ACM', 'the Lenovo Tech World', 'Yong Rui', 'Mustafa Suleyman', 'withLenovo', 'ThinkPad', 'Lenovo Group', 'Cambridge', 'the Lenovo Executive Committee', 'MIT Technology Review', 'the American Association for the Advancement of Science', 'Lee Sedol', 'Insights', 'NPU', 'Lenovo Edge Cloud', 'AlphaGo', 'Giro Studios', 'Massachusetts', 'the Lenovo Advanced Production Scheduling', 'Tech World', 'South Korea', 'IEEE', 'Laurel Ruma', 'Business Lab', 'Lenovo', 'the Massachusetts Institute of Technology', 'DPU']",1,#5500aa,889.6103896103901,796.1038961038965,p_0
"Building the backbone for innovation, speed and thriving humanity",https://www.technologyreview.com/2023/02/08/1067126/building-the-backbone-for-innovation-speed-and-thriving-humanity/,2023,"['AI', 'Global CTO Study', 'LCFC Electronics', 'Edge', 'Kroger', 'withLenovo', 'Chile', 'Santiago', 'MIT Technology Review', 'Yuanqing Yang', 'Lenovo Research', 'Insights', 'Meta', 'Everseen', 'Island Conservation', 'Statista', 'Apple', 'MEC', 'the United States', 'Lenovo']",1,#5500aa,879.2207792207797,764.9350649350654,p_0
The original startup behind Stable Diffusion has launched a generative AI for video,https://www.technologyreview.com/2023/02/06/1067897/runway-stable-diffusion-gen-1-generative-ai-for-video/,2023,"['Dreamix', 'VFX', 'Getty', 'Phenaki', 'Stable Diffusion', 'Stephen Colbert', 'TikTokers', 'the University of Munich', 'Stability AI', 'Meta', 'Runway', 'Google', 'UK', 'Cristóbal Valenzuela', 'MIT Technology Review']",1,#5500aa,390.9090909090911,546.753246753247,p_11
AI models spit out photos of real people and copyrighted images,https://www.technologyreview.com/2023/02/03/1067786/ai-models-spit-out-photos-of-real-people-and-copyrighted-images/,2023,"['Eric Wallace', 'Sameer Singh', 'AI', 'Google DeepMind', 'Google', 'ChatGPT', 'Princeton', 'the University of California', 'UC Berkeley', 'MIT Technology Review', 'Florian Tramèr', 'France', 'ETH Zürich', 'OpenAI', 'Getty Images', 'the University of Caen Normandy', 'Ryan Webster', 'Irvine', 'Imagen']",1,#5500aa,432.4675324675327,733.7662337662342,-1
A watermark for chatbots can expose text written by an AI,https://www.technologyreview.com/2023/01/27/1067338/a-watermark-for-chatbots-can-spot-text-written-by-an-ai/,2023,"['John Kirchenbauer', 'AI startup Hugging Face', 'ChatGPT', 'AI', 'Irene Solaiman', 'OpenAI', 'Tom Goldstein', 'the University of Maryland', 'Meta', 'Google DeepMind', 'CNET', 'MIT Technology Review']",1,#5500aa,432.4675324675327,609.0909090909095,p_11
People are already using ChatGPT to create workout plans,https://www.technologyreview.com/2023/01/26/1067299/chatgpt-workout-plans/,2023,"['GPT', 'London', 'Google', 'England', 'Lee Lem', 'ChatGPT', 'John Yu', 'Rebecca Robinson', 'conversation—“Write', 'Philippe De Wilde', 'UK', 'Twitter', 'MIT Technology Review', 'Austin Goodwin', 'Alex Cohen', 'OpenAI', 'Australia', 'TikTok', 'the University of Kent,', 'Reddit', 'US', 'plan”—it', 'Tennessee', 'Ahmed Mire', 'Carbon Health']",1,#5500aa,567.5324675324679,577.9220779220782,p_11
How Roomba tester’s private images ended up on Facebook,https://www.technologyreview.com/2023/01/26/1067317/podcast-roomba-irobot-robot-vacuums-artificial-intelligence-training-data-privacy-consent-agreement-misled/,2023,"['Facebook and', 'Gemini', 'AI', 'Google', 'Albert Fox Cahn', 'Eileen Guo', 'Yale', 'Anthony Green', 'Harvard', 'Gmail', 'Sora', 'ChatGPT', 'Discord', 'Roomba', 'MIT Technology Review', 'Surveillance Technology', 'Scale AI', 'Tech Review', 'Emma Cillekens', 'Garret Lang', 'Amanda Silverman', 'Mat Honan', 'Jennifer Strong', 'Kennedy School', 'Docs', 'Jacob Gorski', 'Breakthrough Technologies', 'US', 'Dyson', 'iRobot', 'Facebook', 'Stephanie Arnett']",1,#5500aa,214.28571428571436,806.493506493507,-1
An ALS patient set a record for communicating via a brain implant: 62 words per minute,https://www.technologyreview.com/2023/01/24/1067226/an-als-patient-set-a-record-for-communicating-via-a-brain-implant-62-words-per-minute/,2023,"['Stanford', 'BrainGate', 'San Francisco', 'GPT-3', 'Ethicists', 'Lou Gehrig', 'Stanford University', 'Krishna Shenoy', 'ALS', 'the University of California', 'MIT Technology Review', 'Elon Musk', 'UCSF', 'David Moses', 'Edward Chang', 'Paradromics', 'Philip Sabes', 'Jaimie Henderson', 'iPad', 'Neuralink']",1,#5500aa,318.18181818181836,203.89610389610397,p_3
Here’s how Microsoft could use ChatGPT,https://www.technologyreview.com/2023/01/17/1067014/heres-how-microsoft-could-use-chatgpt/,2023,"['PowerPoint', 'Melanie Mitchell', 'AI', 'Stability', 'Chirag Shah', 'KERMIT', 'Google', 'Eileen Guo', 'the University of Washington', 'Verge', 'ChatGPT', 'Stable Diffusion', 'James Vincent', 'Search', 'Roomba', 'MIT Technology Review', 'ERNIEs', 'Outlook and Office', 'DeviantArt', 'Midjourney', 'OpenAI', 'MIT Technology Report', 'Microsoft', 'Bytes', 'ELMo', 'the Santa Fe Institute', 'Facebook', 'the United States', 'BERT', 'The New York Times']",1,#5500aa,328.5714285714287,609.0909090909095,p_11
Radar and laser breakthroughs serve humanitarian ends,https://www.technologyreview.com/2022/12/21/1065658/radar-and-laser-breakthroughs-serve-humanitarian-ends/,2022,"['the Explosive Ordnance Risk Education Advisory Group', 'AI', 'Germany', 'TII', 'Afghanistan', 'Landmine', 'Ruhr University Bochum', 'UAE', 'DERC', 'the Directed Energy Research Center', 'Abu Dhabi', 'Bogota', 'Chaouki Kasmi', 'Myanmar', 'MIT Technology Review', 'U.S.', 'Philippines', 'Insights', 'Slovenia', 'Technology Innovation Institute', 'Advanced Tomography Humanitarian Rover', 'UN', 'Natel Energy', 'the National University of Colombia', 'associaton withTechnology Innovation Institute', 'Pakistan', 'Typhoon Noru']",0,#aa0055,671.4285714285718,598.701298701299,n_7
"The Download: home robot surveillance, and problematic AI text",https://www.technologyreview.com/2022/12/20/1065669/download-home-robot-surveillance-problematic-ai-text/,2022,"['Vox', 'Mexico', 'Amazon', 'Roomba J7', 'AI', 'Nemus', 'Guardian', 'Sam Bankman-Fried', 'Eswar Prasad', 'Jillian Crandall', 'Eileen Guo', 'EU', 'Intercept', 'Bill Gates', 'Verge', 'ChatGPT', 'Salt Lake City’s', 'China', 'Vlad the Impaler', 'UK', 'Roomba', 'Twitter', 'Elon Musk', 'MIT Technology Review', 'Big Tech', 'Scale AI', 'Reuters', 'OpenAI', 'Rest of World', 'NFT', 'TikTok', 'SBF', 'Melissa Heikkilä', 'Venezuela', 'US', 'iRobot', 'Facebook', 'FCC', 'Mastodon', 'Santa']",0,#aa0055,151.94805194805198,245.45454545454555,n_1
How AI-generated text is poisoning the internet,https://www.technologyreview.com/2022/12/20/1065667/how-ai-generated-text-is-poisoning-the-internet/,2022,"['Daphne Ippolito', 'AI', 'Guardian', 'Deeper Learning', 'San Francisco', 'Google DeepMind', 'Eileen Guo', 'ChatGPT', 'Will Douglas Heaven', 'Mike Cook', 'China', 'Roomba', 'MIT Technology Review', 'Sam Altman', 'Scale AI', 'OpenAI', 'Laura Preston', 'Massachusetts', 'Bytes', 'King’s College London', 'Google Brain', 'iRobot', 'Facebook', 'The Chinese Cyberspace Administration']",0,#aa0055,141.5584415584416,297.4025974025975,n_1
A Roomba recorded a woman on the toilet. How did screenshots end up on Facebook?,https://www.technologyreview.com/2022/12/19/1065306/roomba-irobot-robot-vacuums-artificial-intelligence-training-data-privacy/,2022,"['Roborock', 'Amazon', 'Nest', 'Roomba J7', 'Olga Russakovsky', 'Customer Service', 'San Francisco', 'Pete Warden', 'Hive', 'Strategy Analytics', 'Dennis Giese', 'Wu Erqi', 'Discord', 'Northeastern', 'Hom-Bot', 'the California Consumer Privacy Act', 'Office of Technology Research and Investigation', 'France', 'Venezuela', 'the Federal Trade Commission’s', 'iRobot', 'Matt Beane', 'Justin Brookman', 'Bosch', 'Tertill', 'the RX2 Scout Home Vision', 'Google DeepMind', 'Vitak', 'Northeastern University', 'Stanford University', 'ChatGPT', 'Caltrider', 'James Baussmann', 'Santa Barbara', 'Scale AI', 'William Beksi', 'Baussmann', 'Massachusetts', 'Brookman', 'the University of Texas', 'Facebook,', 'Munich', 'Jen Caltrider', 'services”—language', 'US', 'Facebook', 'Colin Angle', 'Bureau of Consumer Protection', 'Germany', 'Samsung', 'Princeton University’s', 'Spain', 'the Illinois Biometric Information Privacy Act', 'Mozilla', 'Alexa', 'China', 'Roomba', 'Shenzhen', 'Jessica Rich', 'Tammy Xu', 'OpenAI', 'Remotasks', 'Consumer Reports', 'Visual AI Lab', 'Miele', 'the University of Maryland', 'Mario Munich', 'Milagros Miceli', 'Kevin Guo', 'Weight Watchers International', 'Project IO', 'Chris Jones', 'LG', 'FTC', 'College of Information Studies', 'Ecovacs', 'Labelers', 'the University of California', 'the Robotic Vision Laboratory', 'Japan', 'MIT Technology Review', 'Arlington', 'Scale', 'Jessica Vitak', 'the University of Maryland’s', 'Helen Greiner', 'NASA', 'Beijing', 'Roombas', 'Dyson', 'the United States']",0,#aa0055,131.1688311688312,287.01298701298714,n_1
Artists can now opt out of the next version of Stable Diffusion,https://www.technologyreview.com/2022/12/16/1065247/artists-can-now-opt-out-of-the-next-version-of-stable-diffusion/,2022,"['Karla Ortiz', 'Washington', 'ChatGPT', 'AI', 'MIT Technology Review', 'Stability', 'The Concept Art Association', 'DC', 'Mat Dryhurst', 'OpenAI', 'US', 'Google DeepMind', 'the Concept Art Association', 'Holly Herndon', 'Dryhurst']",0,#aa0055,598.701298701299,733.7662337662342,-1
I just watched Biggie Smalls perform ‘live’ in the metaverse,https://www.technologyreview.com/2022/12/16/1065393/biggie-smalls-metaverse/,2022,"['Michael Jackson', 'AI', 'Coachella', 'Elliot Osagie', 'Buddy Holly', 'Google DeepMind', 'Hyperreal', 'Andy Serkis', 'Tupac Shakur', 'Amy Winehouse', 'Whitney Houston', 'Jack Nicklaus', 'the University of the West of Scotland', 'Brooklyn', 'Supershoes', 'Biggie Smalls', 'Osagie', 'MIT Technology Review', 'Christopher Wallace', 'Miles Davis', 'Meta', 'Horizon Worlds', 'VFX', 'Willingie', 'Remington Scott', 'Voletta Wallace', 'Facebook', 'Smalls', 'Biggie', 'Barack Obama', 'Theo Tzanidis']",0,#aa0055,536.3636363636367,546.753246753247,-1
Sam Altman: This is what I learned from DALL-E 2,https://www.technologyreview.com/2022/12/16/1065255/sam-altman-openai-lessons-from-dall-e-2/,2022,"['Sam Altman', 'ChatGPT', 'AI', 'MIT Technology Review', 'OpenAI', 'E. GPT-3', 'San Francisco', 'Google DeepMind', 'GPT-3', 'Copilot', 'Elon Musk']",0,#aa0055,453.2467532467535,692.2077922077926,n_4
Modernizing IT helps enterprises do more with less,https://www.technologyreview.com/2022/12/14/1063588/modernizing-it-helps-enterprises-do-more-with-less/,2022,"['MIT', 'Multilateral Investment Guarantee Agency', ""the World Bank Group's"", 'Vijay Yellai', 'WBG', 'Collective Next', 'The World Bank Group', 'Cambridge', 'Martin van den Brink', 'India', 'MIT Technology Review', 'World Bank', 'the International Bank for Reconstruction Development', 'Insights', 'Infosys Cobalt', 'the World Bank Group', 'Massachusetts', 'the International Development Association', 'World Bank Group', 'AAA', 'the World Bank', 'IBRD', 'the International Center for Settling Investment Disputes', 'the Business Lab', 'Laurel Ruma', 'the United States', 'the International Finance Corporation', 'Business Lab', 'the Massachusetts Institute of Technology', 'The Large Hadron Collider']",0,#aa0055,848.0519480519486,837.6623376623381,n_6
"While everyone waits for GPT-4, OpenAI is still fixing its predecessor",https://www.technologyreview.com/2022/11/30/1063878/openai-still-fixing-gpt3-ai-large-language-model/,2022,"['Christopher Columbus', 'Schulman', 'GAN', 'John Schulman', 'ChatGPT', 'Teven Le Scao', 'Mira Murati', 'John Doe', 'OpenAI', 'US', 'Meta', 'San Francisco', 'Google DeepMind', 'Le Scao', 'Sparrow', 'GPT-3', 'MIT Technology Review', 'AI company Hugging Face']",0,#aa0055,442.8571428571431,702.5974025974031,n_4
Here’s my guess: Neuralink will unveil a vision implant at today’s “show and tell”,https://www.technologyreview.com/2022/11/30/1063867/heres-my-guess-neuralink-will-unveil-a-vision-implant-at-todays-show-and-tell/,2022,"['Stanford', 'the New York Times', 'Konrad Kording', 'Spain', 'University of Utah', 'Richard A. Normann', 'Universidad Miguel Hernandez', 'Eduardo Fernandez', 'Joe Rogan', 'Supershoes', 'Krishna Shenoy', 'Twitter', 'MIT Technology Review', 'Elon Musk', 'University of Pennsylvania', 'Neura Pod', 'Meta', 'Utah', 'Sumner Norman', 'the University of Utah years ago', 'US Food and Drug Administration', 'Neuralink', 'Ryan Tanaka']",0,#aa0055,328.5714285714287,193.50649350649357,n_1
Human creators stand to benefit as AI rewrites the rules of content creation,https://www.technologyreview.com/2022/11/29/1063736/human-creators-stand-to-benefit-as-ai-rewrites-the-rules-of-content-creation/,2022,"[""MIT Technology Review's"", 'Synthesia', 'Sam Altman', 'Baidu App', 'AI', 'Gartner', 'MIT Technology Review', 'Wenxin Yige', 'Developed by Zhejiang University', 'Zhejiang University', 'Colorado State Fair', 'Baidu', 'Open AI’s', 'StoryDrawer', 'Baidu Maps', 'InsightSLICE', 'Jason Allen', 'Robin Li']",0,#aa0055,629.8701298701302,370.1298701298703,n_3
The AI myth Western lawmakers get wrong,https://www.technologyreview.com/2022/11/29/1063777/the-ai-myth-western-lawmakers-get-wrong/,2022,"['AI', 'Deeper Learning', 'EU', 'Alibaba', 'Synthesia', 'Sora', 'Will Douglas Heaven', 'China', 'Sesame Credit', 'Amsterdam', 'MIT Technology Review', 'Kendra Schaefer', 'Sam Altman', 'Yann LeCun', 'OpenAI', 'Meta', 'Vincent Brussee', 'the Mercator Institute for China Studies', 'Open AI’s', 'Rongcheng', 'Epoch', 'Zeyi', 'Bytes', 'Beijing', 'US', 'Zeyi Yang']",0,#aa0055,577.9220779220782,318.18181818181836,-1
We could run out of data to train AI language programs,https://www.technologyreview.com/2022/11/24/1063684/we-could-run-out-of-data-to-train-ai-language-programs/,2022,"['Wikipedia', 'Swabha Swayamdipta', 'University of Southern California', 'Stanford University', 'Teven Le Scao', 'AI', 'MIT Technology Review', 'Percy Liang', 'Google DeepMind', 'Pablo Villalobos', 'GPT-3', 'Epoch', 'Swayamdipta', 'AI company Hugging Face']",0,#aa0055,453.2467532467535,712.9870129870134,n_4
China just announced a new social credit law. Here’s what it means.,https://www.technologyreview.com/2022/11/22/1063605/china-announced-a-new-social-credit-law-what-does-it-mean/,2022,"['FBI', 'WeChat', 'a Black Mirror', 'Department of Energy,', 'US-China Economic and Security Review Commission', 'Liaoning', 'Jeremy Daum', 'Google DeepMind', 'Credit China', 'the Supreme People’s Court', 'Douyin', 'Alibaba', 'HUD', 'China', 'China Center', 'Sesame Credit', 'Shanghai', 'EPA', 'MIT Technology Review', 'Kendra Schaefer', 'HHS', 'Tech Review', 'Paul Tsai', 'Lian Weiliang', 'Jiankui', 'Princeton University', 'FDA', 'TikTok', 'Rongcheng', 'IRS', 'the Social Credit System', 'Yale Law School', 'USDA', 'Beijing', 'Shazeda Ahmed', 'Mike Pence', 'Trivium China', 'US', 'George Soros', 'Ant Group']",0,#aa0055,484.4155844155847,183.11688311688317,-1
Watch this robot dog scramble over tricky terrain just by using its camera,https://www.technologyreview.com/2022/11/21/1063585/watch-this-robot-dog-scramble-over-tricky-terrain-just-by-using-its-camera/,2022,"['Deepak Pathak', 'Facebook AI Research', 'Boston Dynamics’ Spot', 'Google DeepMind', 'Google', 'the University of Washington', 'ChatGPT', 'UC Berkeley', 'MIT Technology Review', 'Jie Tan', 'Guanya Shi', 'Agarwal', 'Ashish Kumar', 'OpenAI', 'Akshara Rai', 'Carnegie Mellon', 'Ananye Agarwal', 'Carnegie Mellon University', 'the Conference on Robot Learning']",0,#aa0055,442.8571428571431,785.7142857142862,-1
Why Meta’s latest large language model survived only three days online,https://www.technologyreview.com/2022/11/18/1063487/meta-large-language-model-ai-only-survived-three-days-gpt-3-science/,2022,"['AI', 'Chirag Shah', 'Germany', 'LeCun', 'Google DeepMind', 'Google', 'the Max Planck Institute for Intelligent Systems', 'the University of Washington', 'ChatGPT', 'Princeton', 'Michael Black', 'New York University', 'MIT Technology Review', 'Big Tech', 'Miles Cranmer', 'Yann LeCun', 'Meta', 'OpenAI', 'Microsoft', 'PaLM', 'Gary Marcus']",0,#aa0055,318.18181818181836,661.0389610389614,-1
Inside Alphabet X’s new effort to combat climate change with seagrass,https://www.technologyreview.com/2022/11/09/1062847/inside-alphabet-xs-new-effort-to-combat-climate-change-with-seagrass/,2022,"['the Commonwealth Scientific and Industrial Research Organisation', 'Andy Steven', 'the Indo-Pacific', 'Virginia', 'Bahamas', 'Bianca Bahman', 'the National Academies', 'the University of British Columbia', 'Astro Teller', 'Isaac Santos', 'Amazon', 'the University of Gothenburg', 'Google', 'Alphabet', 'Fiji', 'CSIRO', 'Adelaide', 'National Academies', 'MIT Technology Review', 'Google X', 'Tidal', 'Dandelion Energy', 'Big Tech', 'Sonja Klinsky', 'Indonesia', 'Neil Davé', 'Norway', 'Hector Yee', 'Labuan Bajo', 'Meta', 'Google Translate', 'seagrass', 'Sweden', 'Verra', 'YouTube', 'Malta', 'X', 'California', 'Terry Smith', 'Sunnyvale', 'Grace Young', 'Nations', 'Schrep', 'Range Energy', 'Terre Satterfield', 'the Nature Conservancy’s', 'Seagrass', 'Davé', 'US', 'Google Brain', 'Arizona State University', 'Mike Schroepfer']",0,#aa0055,100.0,442.8571428571431,-1
A new age of disaster recovery planning for SMEs,https://www.technologyreview.com/2022/11/02/1062261/a-new-age-of-disaster-recovery-planning-for-smes/,2022,"['Raimundo Martinez', 'Insights', 'Chiplets', 'Quantum', 'Breakthrough Technologies', 'Accenture', 'Apple Vision Pro', 'Chipmakers', 'MIT Technology Review', 'RPO).3,4', 'RTO']",0,#aa0055,754.545454545455,640.2597402597406,n_7
"This scientist is trying to create an accessible, unhackable voting machine",https://www.technologyreview.com/2022/11/01/1062339/unhackable-voting-machine/,2022,"['Guardian', 'Jon Corzine', 'Florida', 'Harri Hursti', 'Arizona', 'the Help America Vote Act', 'the Postal Service Board of Governors', 'California', 'the National Disability Rights Network', 'George W. Bush', 'Dominion Voting Systems', 'Hart InterCivic', 'the Voting Machine Hacking Village', 'House', 'Pennsylvania', 'the Committee on Foreign Investment in', 'Ohio', 'Undark', 'the New York Times', 'Andrew Appel', 'Shasta County', 'Butler County’s', 'Amber McReynolds', 'EAC', 'New Hampshire', 'Rice University', 'Rachel Tobac', 'Dan Wallach', 'Princeton', 'Applications Quest', 'Jean Louis', 'Twitter', 'Michelle Bishop', 'Eric Corbin', 'Virtual Traffic Stop', 'Michigan', 'the University of Cincinnati', 'Kansas', 'the National Society of Black Engineers', 'New Jersey', 'Las Vegas', 'US', 'UF', 'Cathy Darling Allen', 'VotingWorks', 'Congress', 'Election Systems & Software', 'Smartmatic', 'dupe', 'Intercept', 'Oregon', 'the University of Florida', 'fed', 'the Voting Village', 'Voting Village', 'Louis of the', 'Debra Bowen', 'Diebold', 'Princeton University', 'the Alabama Institute for the Deaf and Blind', 'Ben Hovland', 'HAVA', 'Senate', 'Juan Gilbert', 'Juan Gilbert’s', 'Miami University', 'AI', 'Black', 'York County', 'Computing for Social Good Lab', 'BMD', 'the United States’', 'Walden O’Dell', 'the Election Assistance Commission', 'Hamilton', 'America', 'L. Ron Hubbard', 'Minnesota', 'O’Dell', 'MIT Technology Review', 'the City and County of Denver', 'Donald Trump', 'Ben Adida', 'the United States', 'Butler County', 'Spenser Mestel']",0,#aa0055,214.28571428571436,390.9090909090911,-1
Responsible AI has a burnout problem,https://www.technologyreview.com/2022/10/28/1062332/responsible-ai-has-a-burnout-problem/,2022,"['New York', 'Margaret Mitchell', 'Boston Consulting Group', 'AI', 'Vivek Katial', 'Google DeepMind', 'Google', 'EU', 'Ethicists', 'ChatGPT', 'Hugging Face', 'MIT Sloan Management Review', 'the White House', 'Machine Learning Ethics', 'Twitter', 'MIT Technology Review', 'Rumman Chowdhury', 'the Montreal AI Ethics Institute', 'Emmanuel Goffi', 'the US Federal Trade Commission', 'Abhishek Gupta', 'Ethical AI', 'Stability AI', 'Meta', 'the Global AI Ethics Institute', 'Katial', 'OpenAI', 'Timnit Gebru', 'Weight Watchers', 'California', 'US', 'Emad Mostaque', 'Goffi']",0,#aa0055,422.07792207792227,557.1428571428575,-1
We used to get excited about technology. What happened?,https://www.technologyreview.com/2022/10/21/1061260/innovation-technology-what-happened/,2022,"['Horizon Worlds', 'Ring Nation', 'the Centre for Technomoral Futures', 'Ring', 'Amazon', 'Ethics of Data and Artificial Intelligence', 'Shannon Vallor', 'the Edinburgh Futures Institute', 'Mark Zuckerberg', 'Social media’s', 'Meta', 'ag', 'US', 'John Deere', 'Baillie Gifford', 'the University of Edinburgh', 'Roomba', 'MIT Technology Review']",0,#aa0055,744.1558441558445,588.3116883116886,n_7
A bias bounty for AI will help to catch unfair algorithms faster,https://www.technologyreview.com/2022/10/20/1061977/ai-bias-bounty-help-catch-unfair-algorithms-faster/,2022,"['Stanford', 'Amazon', 'Alex Engler', 'AI', 'Splunk', 'Intelligence', 'Mozilla', 'EU', 'Synthesia', 'Sora', 'Stanford University', 'the Bias Buccaneers', 'Twitter', 'MIT Technology Review', 'Rumman Chowdhury', 'the Montreal AI Ethics Institute', 'Abhishek Gupta', 'The US National Institute of Standards and Technology', 'the Brookings Institution', 'the Digital Services Act', 'OpenAI', 'Microsoft', 'Deborah Raji', 'Sara Hooker']",0,#aa0055,422.07792207792227,536.3636363636367,-1
"The Download: the aging/disease debate, and WeChat’s dark side",https://www.technologyreview.com/2022/10/19/1061916/download-aging-disease-debate-wechat-dark-side/,2022,"['Vox', 'WeChat', 'Sarah Sloat', 'AI', 'Guardian', 'Google', 'congress', 'EU', 'WhatsApp', 'Verge', 'Darth Vader', 'Apple Podcasts', 'Alex Hanna', 'China', 'the In Machines We Trust', 'Uganda', 'Karnataka', 'UK', 'India', 'Tencent', 'MIT Technology Review', 'Twitter', 'James Temple', 'Mia Landsem', 'Big Tech', 'Reuters', 'Signal', 'Nvidia', 'Meta', 'James McDivitt', 'the World Health Organization', 'Austin Li', 'China Report', 'Timnit Gebru', 'Zeyi', 'NASA', 'NBC', 'the Washington Post', 'Beijing', 'Alex Serdiuk', 'Giphy', 'US', 'Telegram', 'Zeyi Yang', 'International Classification of Diseases', 'Singapore']",0,#aa0055,193.50649350649357,141.5584415584416,n_1
Alex Hanna left Google to try to save AI’s future,https://www.technologyreview.com/2022/10/19/1061075/alex-hanna-google-ai-research/,2022,"['Milagros Miceli', 'AI', 'Lahore', 'Hanna, DAIR', 'Google DeepMind', 'Google', 'Perspective Magazine', 'ChatGPT', 'DAIR', 'Alex Hanna', 'Meg Mitchell', 'Distributed AI Research Institute', 'Twitter', 'MIT Technology Review', 'the Distributed AI Research Institute', 'Gebru', 'Ethical AI', 'OpenAI', 'Raesetje Sefala', 'Anmol Irfan', 'Timnit Gebru', 'Berlin', 'Hanna', 'Egypt', 'Pakistan', 'Timnit Gebru’s', 'Facebook', 'South Africa']",0,#aa0055,536.3636363636367,442.8571428571431,n_2
Why AI shouldn’t be making life-and-death decisions,https://www.technologyreview.com/2022/10/17/1061738/why-ai-shouldnt-be-making-life-and-death-decisions/,2022,"['PowerPoint', 'Steve Jobs', 'Amazon', 'AI', 'Will Heaven', 'Melissa\nDeep Dive', 'Netherlands', 'Kotaku', 'Google', 'Clem Delangue', 'Sarco', 'Verge', 'Alexa', 'AI/ML', 'Joe Rogan', 'Hugging Face', 'Mark Zuckerberg', 'Tanya Basu', 'Distributed AI Research Institute', 'MIT Technology Review', 'Steve Jobs’s', 'Meta', 'OpenAI', 'The Washington Post', 'Nitschke', 'Microsoft', 'Timnit Gebru', 'Philip Nitschke', 'Bytes', 'Office', 'Deeper Learning\nMeta', 'Switzerland', 'Tour Amazon']",0,#aa0055,505.19480519480544,474.0259740259743,-1
"Machine learning operations offer agility, spur innovation",https://www.technologyreview.com/2022/10/12/1060890/machine-learning-operations-offer-agility-spur-innovation/,2022,"['Vincent David', 'Sora', 'MLOps', 'McKinsey', 'Insights', 'Genie', 'OpenAI', 'Lego', 'Google DeepMind', 'Super Mario', 'ML', 'Capital One', 'MIT Technology Review', 'ML engineers']",0,#aa0055,619.4805194805199,858.441558441559,n_5
