title,url,year,entities,temperature,color,x,y,cluster
2024 Innovator of the Year: Shawn Shan builds tools to help artists fight back against exploitative AI,https://www.technologyreview.com/2024/09/10/1102936/innovator-year-shawn-shan-2024/,2024,"['Karla Ortiz', 'Amy Nordrum', 'Nightshade', ""MIT Technology Review's"", 'the Usenix Security Symposium', 'ChatGPT', 'AI', 'Midjourney', 'Ben Zhao', 'Heather Zheng', 'Watch Shan', 'OpenAI', 'the University of Chicago', 'Google DeepMind', 'Glaze', 'MIT Technology Review', 'Shawn Shan']",2,#0000ff,453.2467532467535,484.4155844155847,p_11
What impact will AI have on video game development?,https://www.technologyreview.com/2024/09/10/1103752/what-impact-will-ai-have-on-video-game-development/,2024,"['Verge', 'ChatGPT', 'AI', 'Clearview', 'Midjourney', 'Netherlands', 'OpenAI', 'a16z', 'Clearview AI', 'LA', 'Google DeepMind', 'the US National Security Agency', 'Ubisoft', 'The New York Times', 'MIT Technology Review', 'Josh Kahn']",2,#0000ff,536.3636363636367,671.4285714285718,p_11
"To be more useful, robots need to become lazier",https://www.technologyreview.com/2024/09/09/1103733/to-be-more-useful-robots-need-to-become-lazier/,2024,"['Amazon', 'Polani', 'AI', 'Chris Walti', 'Netherlands', 'Tech United', 'Google DeepMind', 'the University of Hertfordshire', 'René van de Molengraft', 'Eindhoven University of Technology', 'ChatGPT', 'Bold Hearts', 'Tech United’s', 'Michael Wolf', 'RoboCup', 'UK', 'MIT Technology Review', 'OpenAI', 'Tesla', 'Amazon Robotics', 'Daniel Polani', 'Van de Molengraft']",2,#0000ff,494.8051948051951,733.7662337662342,-1
Roblox is launching a generative AI that builds 3D environments in a snap,https://www.technologyreview.com/2024/09/06/1103707/roblox-is-launching-a-generative-ai-that-builds-3d-environments-in-a-snap/,2024,"['Chris Totten', 'Paris', 'AI', 'Roblox', 'ChatGPT', 'Kent State University', 'France', 'OpenAI', 'MIT Technology Review', 'Marcus Holmström', 'Google DeepMind', 'Anupam Singh', 'The Gang']",2,#0000ff,515.5844155844159,650.649350649351,p_11
Integrating security from code to cloud,https://www.technologyreview.com/2024/09/05/1097020/integrating-security-from-code-to-cloud/,2024,"['withMicrosoft', 'Azure', 'AI', 'Microsoft Security', 'AMD', 'David Harmon', 'Google DeepMind', 'Microsoft Azure', 'SpaceX', 'Vlad Korsunsky', 'Linux', 'the Linux Foundation', 'MIT Technology Review', 'The Confidential Computing Consortium', 'Insights', 'Trusted Execution Environment', 'Jiankui', 'OSS', 'Korsunsky', 'Microsoft', 'Tesla', 'The Human Genome Project', 'TEE', 'AMD EPYC']",2,#0000ff,640.2597402597406,671.4285714285718,-1
The UK is building an alarm system for climate tipping points,https://www.technologyreview.com/2024/09/04/1103555/the-uk-is-building-an-alarm-system-for-climate-tipping-points/,2024,"['Sarah Bohndiek', 'Amazon', 'Gemma Bale', 'the Greenland Ice Sheet', 'Jaime Palter', 'Google', 'Canada', 'the University of Rhode Island', 'Johns', 'UK', 'MIT Technology Review', 'Subpolar Gyre', 'Big Tech', 'Meta', 'AMOC', 'William Johns', 'the University of Cambridge', 'ARPA', 'Schrep', 'the University of Miami', 'Greenland', 'US', 'the Atlantic Meridional Overturning Circulation', 'DARPA', 'neurotechnologies', 'Mike Schroepfer', 'The Advanced Research and Invention Agency']",2,#0000ff,110.3896103896104,453.2467532467535,-1
"The Download: climate tipping point alarms, and AI’s vision of the 3028 Olympics",https://www.technologyreview.com/2024/09/04/1103615/the-download-climate-tipping-point-alarms-and-ais-vision-of-the-3028-olympics/,2024,"['Vox', 'New York', 'Spotify', 'Supreme Court', 'New Zealand', 'AI', 'Hawaii', 'Colorado', 'Netherlands', 'Pueblo', 'San Francisco', 'CrowdStrike', 'San Bernardino County’s', 'Mega AI', 'The Chinese Communist Party', 'Josh Kahn', 'Verge', 'Paris', 'Clearview', 'Alexandre de Moraes', 'Apple Podcasts', 'LinkedIn', 'Los Angeles', 'News Over Audio', 'China', 'Lego', 'Apple Intelligence', 'UK', 'MIT Technology Review', 'James Temple', 'Pokemon', 'Paralympics', 'Financial Times', 'the multi-billion dollar', 'OpenAI', 'Amy Nordum', 'Clearview AI', 'Kilmartin Glen', 'TechCrunch', ""James O'Donnell"", 'Microsoft', 'Peter Blackert', 'Bluesky', 'X', 'Ars Technica', 'US', 'Hydrogen', 'the United States', 'Benjamin Schneider', 'Tokelau', 'Brazil']",2,#0000ff,203.89610389610397,276.62337662337677,p_4
AI’s impact on elections is being overblown,https://www.technologyreview.com/2024/09/03/1103464/ai-impact-elections-overblown/,2024,"['AI', 'the University of Zurich', 'London', 'Online Safety Act', 'Google DeepMind', 'AI and News', 'the Study of Journalism', 'Davos', 'Nick Clegg', 'ChatGPT', 'Lisa Monaco', 'Pope Francis', 'Sadiq Kahn', 'UK', 'MIT Technology Review', 'Meta', 'OpenAI', 'Armageddon', 'Sacha Altay', 'Russia', 'Keegan McBride', 'Felix M. Simon', 'Switzerland', 'US', 'the Reuters Institute', 'Viola Amherd', 'Adversarial Threat Report', 'the United States', 'Alan Turing Institute', 'the Oxford Internet Institute']",2,#0000ff,245.45454545454555,297.4025974025975,-1
"The Download: election tech fears, and AI for teachers",https://www.technologyreview.com/2024/09/03/1103506/the-download-election-tech-fears-and-ai-for-teachers/,2024,"['the New York Times', 'Supreme Court', 'AI', 'Guardian', 'the University of Zurich', 'CrowdStrike', 'AI and News', 'the Study of Journalism', 'Canada', 'Intel', 'ChatGPT', 'China', 'Tanya Basu', 'dryland', 'Apple Intelligence', 'UK', 'India', 'MIT Technology Review', 'Reuters', 'Nvidia', 'OpenAI', 'Clearview AI', 'Sacha Altay', 'Brian Jones', 'Keegan McBride', ""James O'Donnell"", 'Taiwan', 'Felix M. Simon', 'Undark Magazine', 'US', 'the Reuters Institute', 'Alexander Grothendieck', 'Hollywood', 'Brazil', 'the Oxford Internet Institute']",2,#0000ff,203.89610389610397,255.84415584415595,p_4
Here’s how ed-tech companies are pitching AI to teachers,https://www.technologyreview.com/2024/09/03/1103481/heres-how-ed-tech-companies-are-pitching-ai-to-teachers/,2024,"['Khanmigo', 'MIT', 'AI', 'Colorado', 'Antonio Regalado.', 'Google DeepMind', 'North Carolina', 'Pressto', 'ChatGPT', 'Leon Furze', 'Khan Academy', 'Japan', 'MIT Technology Review', 'McKinsey', 'Nvidia', 'Financial Times', 'OpenAI', 'Microsoft', 'California', 'Pew', 'Apple', 'South Korea', 'Magic School', 'US', 'Deakin University', 'Singapore']",2,#0000ff,546.753246753247,640.2597402597406,p_11
What this futuristic Olympics video says about the state of generative AI,https://www.technologyreview.com/2024/09/03/1103516/what-this-futuristic-olympics-video-says-about-the-state-of-generative-ai/,2024,"['LeBron James', 'AI', 'Google DeepMind', 'Josh Kahn', 'Synthesia', 'Paris', 'Sora', 'ChatGPT', 'Snap', 'Los Angeles', 'China', 'Alex Mashrabov', 'Temu', 'MIT Technology Review', 'Higgsfield AI', 'Paralympics', 'OpenAI', 'the Chicago Bulls', 'LA']",2,#0000ff,557.1428571428575,609.0909090909095,p_11
Coming soon: Our 2024 list of Innovators Under 35,https://www.technologyreview.com/2024/09/03/1103450/coming-soon-2024-innovators-under-35/,2024,"['MIT', 'AI', 'LinkedIn', 'Massachusetts', 'Cambridge', 'Jiankui', 'Google DeepMind', 'MIT Technology Review', 'EmTech MIT']",2,#0000ff,764.9350649350654,754.545454545455,-1
How “personhood credentials” could help prove you’re a human online,https://www.technologyreview.com/2024/09/02/1103466/how-personhood-credentials-could-help-prove-youre-a-human-online/,2024,"['MIT', 'AI', 'Spain', 'Google DeepMind', 'the University of Southern California', 'Synthesia', 'Harvard', 'ChatGPT', 'Emilio Ferrara', 'UK', 'India', 'MIT Technology Review', 'Henry Ajder', 'OpenAI', 'Martin Tschammer', 'Idena', 'Meta', 'Microsoft', 'Tobin South', 'arXiv', 'Kenya', 'Hong Kong', 'Brazil', 'Worldcoin']",2,#0000ff,546.753246753247,598.701298701299,p_11
"The Download: monkey names, and smart masks for health monitoring",https://www.technologyreview.com/2024/08/30/1103390/the-download-monkey-names-and-smart-masks-for-health-monitoring/,2024,"['Spotify', 'Supreme Court', 'Anil Ananthaswamy', 'AI', 'CrowdStrike', 'Scott J Mulligan', 'Knowable Magazine', 'ChatGPT', 'Starlink', 'the Financial Times', 'Apple Intelligence', 'Axios', 'MIT Technology Review', 'Elon Musk', 'Sophia Chen', 'AI\nTeachers', 'Frontier', 'Meta', 'OpenAI', 'Clearview AI', 'Rest of World', 'FDA', 'Tesla', '+ Apple', 'Antonio Regalado', 'New Yorker $', 'Apple', 'US', 'Telegram', 'LA', 'Brazil']",2,#0000ff,214.28571428571436,245.45454545454555,p_4
A new way to build neural networks could make AI more understandable,https://www.technologyreview.com/2024/08/30/1103385/a-new-way-to-build-neural-networks-could-make-ai-more-understandable/,2024,"['Xi’an Jiaotong-Liverpool University', 'MIT', 'Anil Ananthaswamy', 'AI', 'Google DeepMind', 'ChatGPT', 'fed', 'MLP', 'Dutton', 'China', 'Ziming Liu', 'New York University', 'MIT Technology Review', 'Di Zhang', 'KANs', 'OpenAI', 'Max Tegmark', 'Kolmogorov-Arnold Networks', 'Caltech', 'Andrew Wilson', 'US', 'Suzhou', 'KAN', 'GitHub']",2,#0000ff,484.4155844155847,806.493506493507,p_8
How machine learning is helping us probe the secret names of animals,https://www.technologyreview.com/2024/08/29/1103353/how-machine-learning-is-helping-us-probe-the-secret-names-of-animals/,2024,"['David Omer', 'Cricopat', 'Hebrew University', 'Marmosets', 'ChatGPT', 'AI', 'Kenya', 'Israel', 'OpenAI', 'Cornell University', 'Google DeepMind', 'the Earth Species Project', 'Mickey Pardo', 'T.S. Eliot', 'MIT Technology Review', 'Project CETI']",2,#0000ff,557.1428571428575,650.649350649351,p_11
Will computers ever feel responsible?,https://www.technologyreview.com/2024/08/28/1096801/responsible-machines-computers-human-intelligent-decisions/,2024,"['Stuart Dreyfus', 'Bill Gourgey', 'AI', 'Berkeley', 'Google DeepMind', 'Washington', 'von Neumann', 'ChatGPT', 'John von Neumann', 'UC Berkeley', 'MIT Technology Review', 'IBM', 'DC', 'Dreyfus', 'Albert Einstein', 'Jiankui', 'Macmillan', 'Perceptron', 'Frank Rosenblatt', 'Technology Review']",2,#0000ff,640.2597402597406,754.545454545455,-1
A skeptic’s guide to humanoid-robot videos,https://www.technologyreview.com/2024/08/27/1103035/a-skeptics-guide-to-humanoid-robot-videos/,2024,"['Spanx', 'Verge', 'Georgia', 'Figure AI', 'ChatGPT', 'the University of California, Berkeley', 'AI', 'MIT Technology Review', 'Meta', 'Agility Robotics', 'Anthropic', 'Ken Goldberg', 'Google DeepMind', 'Google', 'Rhiannon Williams']",2,#0000ff,474.0259740259743,629.8701298701302,p_11
What will AI mean for economic inequality?,https://www.technologyreview.com/2024/08/27/1096133/ai-economic-inequality-jobs-low-income/,2024,"['AI', 'AI R&D', 'Google DeepMind', 'UN Global Pulse', 'Katya Klinova', 'MIT Technology Review']",2,#0000ff,661.0389610389614,712.9870129870134,p_10
Ray Kurzweil: Technology will let us fully realize our humanity,https://www.technologyreview.com/2024/08/27/1096148/ray-kurzweil-futurist-ai-medicine-advances-freedom/,2024,"['Sora', 'AI', 'ChatGPT', 'Midjourney', 'Rome', 'OpenAI', 'Wagner', 'Digital', 'Jetsons', 'Google DeepMind', 'MIT Technology Review', 'Ray Kurzweil']",2,#0000ff,546.753246753247,681.8181818181822,p_11
AI and the future of sex,https://www.technologyreview.com/2024/08/26/1096526/ai-sex-relationships-porn/,2024,"['Mexico', 'AI', 'London', 'Project 2025', 'Google DeepMind', 'Taylor Swift', 'Stonehenge', 'Sora', 'ChatGPT', 'the Heritage Foundation', 'Leo Herrera', 'Almendralejo', 'Cheesecake Factory', 'MIT Technology Review', 'Michigan', 'OpenAI', 'Australia', 'Quebec', 'US', 'Hollywood']",2,#0000ff,567.5324675324679,619.4805194805199,p_11
AI could be a game changer for people with disabilities,https://www.technologyreview.com/2024/08/23/1096607/ai-people-with-disabilities-accessibility/,2024,"['the New York Times', 'Steven Aquino', 'ChatGPT', 'AI', 'Tatum Robotics', 'Midjourney', 'OpenAI', 'Waymo', 'Jaguar', 'San Francisco', 'Google DeepMind', 'Adobe Firefly', 'Google', 'American Sign Language', 'MIT Technology Review', 'Boston']",2,#0000ff,536.3636363636367,712.9870129870134,-1
Tech that measures our brainwaves is 100 years old. How will we be using it 100 years from now?,https://www.technologyreview.com/2024/08/22/1097185/tech-brainwaves-100-years/,2024,"['Chengdu', 'North Carolina', 'The San Francisco Standard', 'Durham', 'ChatGPT', 'San Francisco’s', 'Nita Farahany', 'China', 'UK', 'BBC Future', 'Gilead Sciences', 'MIT Technology Review', 'Faisal Mushtaq', 'PrEP4All', 'Nature Medicine', 'Duke University', 'Pedro Valdes-Sosa', 'the University of Electronic Science and Technology of China', 'Jiankui', 'the University of Leeds', 'Ross Compton', 'Antonio Regalado', 'The Checkup', 'Hans Berger', 'US', 'Rhiannon Williams', 'Ohio']",2,#0000ff,318.18181818181836,266.23376623376635,p_3
We finally have a definition for open-source AI,https://www.technologyreview.com/2024/08/22/1097224/we-finally-have-a-definition-for-open-source-ai/,2024,"['OSI', 'Avijit Ghosh', 'Amazon', 'ChatGPT', 'AI', 'MIT Technology Review', 'Hugging Face', 'Meta', 'Anthropic', 'OpenAI', 'Google DeepMind', 'Google', 'Mozilla', 'Bdeir', 'Ayah Bdeir']",2,#0000ff,422.07792207792227,598.701298701299,p_11
A new system lets robots sense human touch without artificial skin,https://www.technologyreview.com/2024/08/21/1097168/a-new-system-lets-robots-sense-human-touch-without-artificial-skin/,2024,"['the BioRobotics Institute', 'the Neuro-Robotic Touch Laboratory', 'MIT Technology Review', 'Maged Iskandar', 'Oddo', 'the German Aerospace Center', 'Science Robotics', 'Iskandar', 'Google DeepMind', 'Calogero Maria Oddo']",2,#0000ff,598.701298701299,775.3246753246758,p_7
How to fine-tune AI for prosperity,https://www.technologyreview.com/2024/08/20/1096733/how-to-fine-tune-ai-for-prosperity/,2024,"['Stanford', 'MIT', 'Gemini', 'Faez Ahmed', 'Thomas Edison', 'AI', 'TFP', 'Goldman Sachs', 'Google DeepMind', 'Google', 'the University of Virginia', 'AlphaFold', 'ChatGPT', 'Ranveer Chandra', 'Dogus Cubuk', 'Princeton', 'Med-Gemini', 'Anton Korinek', 'the University of Chicago', 'Microsoft Research', 'the McKinsey Global Institute', 'the University of California', 'John Van Reenen', 'the London School of Economics', 'the US Census Bureau', 'MIT Technology Review', 'Acemoglu', 'Big Tech', 'Santa Barbara', 'Solow', 'Leslie Schoop', 'Robert Solow', 'Microsoft', 'Michael Spence', 'Foreign Affairs', 'DeepMind', 'Tech', 'Daron Acemoglu', 'Chad Syverson', 'US', 'James Manyika', 'the US Bureau of Labor Statistics']",2,#0000ff,390.9090909090911,733.7662337662342,p_11
Why you’re about to see a lot more drones in the sky,https://www.technologyreview.com/2024/08/20/1097005/why-youre-about-to-see-a-lot-more-drones-in-the-sky/,2024,"['Spotify', 'Amazon', 'AI', 'Gemini Live', 'FAA', 'Google DeepMind', 'Escaping Spotify', 'Google', 'Eileen Guo', 'the American Civil Liberties Union', 'DHS', 'T-Mobile', 'FedEx', 'MIT Technology Review', 'Airbus', 'Distribution Strategy Group', 'Deepfake Elon Musk’', 'Texas', 'Speech, Privacy', 'the American Civil Liberties Union’s', 'OpenAI', 'Prime Air', 'Bytes', 'The US Department of Homeland Security', 'John Boyd', 'UPS', 'The AI Risk Repository', 'US', 'Technology Project', 'Jay Stanley', 'Office of Biometric Identity Management', 'The New York Times', 'FRT', 'the Federal Aviation Administration']",2,#0000ff,390.9090909090911,463.63636363636385,p_9
How to break free of Spotify’s algorithm,https://www.technologyreview.com/2024/08/16/1096276/spotify-algorithms-music-discovery-ux/,2024,"['Spotify', 'Music League', 'AI', 'the Echo Nest', 'Curiosity', 'Chayka', 'Music League and Oddly Specific Playlists', 'Pearl Jam', 'Google DeepMind', 'Everynoise.com', 'Apple Music', 'Forbes', 'Blender', 'Radiooooo, Music League', 'Discover Weekly', 'Glenn McDonald', 'The Hong Kong', 'the Dave Matthews Band', 'Eaton Radio', 'NME', 'The Notorious B.I.G.', 'Kyle Chayka', 'Zack O’Malley Greenburg', 'Greenburg', 'Unchartify', 'MIT Technology Review', 'Distribution Strategy Group', 'Alex Antenna', 'Tiffany Ng', 'Jiankui', 'TikTok', 'Amazon Music', 'New Yorker', 'New Jersey', 'Oddly Specific Playlists', 'McDonald', 'Facebook', 'Alex Keller']",2,#0000ff,723.3766233766238,733.7662337662342,-1
What’s next for drones,https://www.technologyreview.com/2024/08/16/1096517/whats-next-for-drones/,2024,"['Amazon', 'The Scottsdale Police Department', 'Scottsdale', 'FAA', 'Google DeepMind', 'Google', 'Zipline', 'the University of Missouri', 'St. Louis', 'ChatGPT', 'Shakiba Enayati', 'ACLU', 'China', 'UK', 'MIT Technology Review', 'Shenzhen', 'Wing Aviation', 'Unusual Machine', 'Arizona', 'Andriy Dovbenko', 'Stanley', 'the US Department of Defense’s Defense Innovation Unit', 'Allan Evans', 'Texas', 'Speech, Privacy', 'the American Civil Liberties Union’s', 'OpenAI', 'Rich Slavin', 'Ukraine Tech Exchange', 'Ukraine', 'Russia', 'Aerodome', 'Prime Air', 'the Department of Defense’s Replicator', 'Chula Vista', 'California', 'The American Security Drone Act', 'Gaza', 'US', 'the Atlas of Surveillance', 'Technology Project', 'the Blue UAS Cleared List', 'Jay Stanley', 'the American Security Drone Act', 'the Federal Aviation Administration']",2,#0000ff,401.29870129870153,432.4675324675327,p_9
DHS plans to collect biometric data from migrant children “down to the infant”,https://www.technologyreview.com/2024/08/14/1096534/homeland-security-facial-recognition-immigration-border/,2024,"['New York', 'Schuckers', 'Syracuse University’s', 'Office of the Inspector General', 'Jeff Merkley', 'The Department of Homeland Security', 'Afghanistan', 'Iraq', 'Ashley Gorski', 'the Federal Identity Forum and Exposition', 'US Customs and Border Protection', 'Future Identity', 'Google DeepMind', 'Justin Krakoff', 'US Immigration and Customs Enforcement', 'Clarkson University', 'the US Visitor', 'Oregon', 'US Citizenship and Immigration Services', 'ChatGPT', 'the university’s Institutional Review Board', 'the American Civil Liberties Union', 'the Department of Justice', 'Department', 'DHS', 'Stephanie Schuckers', 'MIT Technology Review', 'USCIS', 'Transactional Records Access Clearinghouse (TRAC', 'OIG', 'John F. Kelly', 'Merkley', 'CBP', 'CITeR', 'Signal', 'Georgetown Law School’s Center on Privacy and Technology', 'OpenAI', 'The US Department of Homeland Security', 'Petra Molnar', 'John Boyd', 'the US Transportation Security Administration', 'the Center for Identification Technology Research', 'The Office of Biometric Identity Management', 'CBP One', 'US', 'Dinesh McCoy', 'the United States', 'the Government Accountability Office', 'Office of Biometric Identity Management', 'Panama', 'FRT', 'the Department of Defense']",2,#0000ff,380.5194805194807,453.2467532467535,p_9
A new public database lists all the ways AI could go wrong,https://www.technologyreview.com/2024/08/14/1096455/new-database-lists-ways-ai-go-wrong/,2024,"['FutureTech', 'MIT', 'MIT FutureTech', 'Center for AI Safety', 'Neil Thompson', 'Deep Dive\nArtificial', 'AI', 'Stanford University', 'ChatGPT', 'The AI Risk Repository', 'OpenAI', 'Google DeepMind', 'Anka Reuel', 'MIT Technology Review', 'Peter Slattery']",2,#0000ff,515.5844155844159,671.4285714285718,p_11
Here’s how people are actually using AI,https://www.technologyreview.com/2024/08/12/1096202/how-people-actually-using-ai/,2024,"['Oof', 'Humane AI Pins', 'AI', 'Google DeepMind', 'Robert Mahari', 'Google', 'Satya Nadella', 'Verge', 'ChatGPT', 'UK', 'MIT Technology Review', 'Sam Altman', 'the MIT Media Lab', 'Financial Times', 'Yoshua Bengio', 'OpenAI', 'Microsoft', 'Bytes', 'Pat Pataranutaporn', 'Humane', 'Infuriatingly', 'Rhiannon Williams', 'Harvard Law School', 'JD-PhD']",2,#0000ff,463.63636363636385,640.2597402597406,p_11
Google DeepMind trained a robot to beat humans at table tennis,https://www.technologyreview.com/2024/08/09/1096102/google-deepmind-trained-a-robot-to-beat-humans-at-table-tennis/,2024,"['MIT Technology Review', 'Chris Walti', 'fed', 'Arxiv', 'Lerrel Pinto', 'Google DeepMind', 'New York University', 'Pannag Sanketi', 'Tesla']",2,#0000ff,494.8051948051951,816.8831168831174,p_8
Advancing to adaptive cloud,https://www.technologyreview.com/2024/08/08/1095619/advancing-to-adaptive-cloud/,2024,"['Spotify', 'Azure', 'withMicrosoft', 'Chicago', 'Azure Edge', 'AI', 'Insights', 'MIT Technology Review', 'AMD', 'PsiQuantum', 'US', 'David Harmon', 'Bernardo Caldas', 'Microsoft', 'Microsoft Copilot', 'Microsoft Azure']",2,#0000ff,640.2597402597406,650.649350649351,p_10
"The Download: AIDS denialism, and AI safety mechanisms",https://www.technologyreview.com/2024/08/07/1095906/the-download-aids-denialism-and-ai-safety-mechanisms/,2024,"['IBM IBM', 'AI', 'CNN', 'Guardian', 'Waymo', 'Bret Weinstein', 'San Francisco', 'Google', 'SpaceX', 'Verge', 'Joe Rogan', 'San Francisco’s', 'Michael Marshall', 'Los Angeles', 'China', 'UK', 'India', 'Elon Musk', 'Ted Egan', 'MIT Technology Review', 'US Congress', 'Starliner', 'Yoshua Bengio', 'China Report', 'Anna Merlan', 'Iran', 'NASA', 'California', 'Melissa Heikkilä', 'Ars Technica', 'New Yorker $', 'the Washington Post', 'Harvard University', 'This lion cub', 'US', 'Telegram', ""Donald Trump's"", 'Zeyi Yang']",2,#0000ff,203.89610389610397,172.72727272727278,p_4
AI “godfather” Yoshua Bengio has joined a UK project to prevent AI catastrophes,https://www.technologyreview.com/2024/08/07/1095879/ai-godfather-yoshua-bengio-joins-uk-project-to-prevent-ai-catastrophes/,2024,"['Safeguarded AI', 'Advanced Research and Invention Agency', 'AI', 'UN', 'ARIA', 'Yoshua Bengio', 'David “davidad” Dalrymple', 'Google DeepMind', 'the International Scientific Report', 'UK', 'EU', 'MIT Technology Review']",2,#0000ff,588.3116883116886,494.8051948051951,-1
Google is finally taking action to curb non-consensual deepfakes,https://www.technologyreview.com/2024/08/06/1095774/google-is-finally-taking-action-to-curb-non-consensual-deepfakes/,2024,"['AI', 'Guardian', 'Google DeepMind', 'Jessica Hamzelou', 'Google', 'Taylor Swift', 'EU', 'Synthesia', 'Alexa', 'ChatGPT', 'the US Senate', 'The Wall Street Journal', 'the US National Institutes of Health', 'David Wendler', 'AI Studio', 'UK', 'MIT Technology Review', 'Henry Ajder', 'AI Act', 'The European Commission', 'OpenAI', 'Meta', 'Paris Hilton', 'Bytes', 'Sophie', 'Enter AI:', 'House', 'Ajder', 'the European Union']",2,#0000ff,453.2467532467535,546.753246753247,p_11
A playbook for crafting AI strategy,https://www.technologyreview.com/2024/08/05/1095447/a-playbook-for-crafting-ai-strategy/,2024,"['Synthesia', 'Infosys', 'the University of Oxford', 'AI', 'Insights', 'PwC', 'US', 'SP Singh', 'Goldman Sachs', 'Google DeepMind', 'MIT Technology Review']",2,#0000ff,692.2077922077926,640.2597402597406,p_10
We need to prepare for ‘addictive intelligence’,https://www.technologyreview.com/2024/08/05/1095600/we-need-to-prepare-for-addictive-intelligence/,2024,"['Pat Pataranutaporn', 'the MIT Media Lab', 'Sherry Turkle', 'ChatGPT', 'AI', 'Turkle', 'OpenAI', 'YouTube', 'Google DeepMind', 'Robert Mahari', 'TikTok', 'MIT Technology Review', 'Harvard Law School', 'JD-PhD']",2,#0000ff,463.63636363636385,681.8181818181822,p_11
"The Download: making tough decisions with AI, and the significance of toys",https://www.technologyreview.com/2024/08/02/1095598/the-download-making-tough-decisions-with-ai-and-the-significance-of-toys/,2024,"['Bill Gourgey', 'Amazon', 'AI', 'Keanu Reeves', 'Guardian', 'Jessica Hamzelou', 'Google', 'Instagram', 'Verge', 'Knowable Magazine', 'Alex Winter', 'China', 'Quanta Magazine', 'AI Studio', 'Turkey', 'MIT Technology Review', 'Hamas', 'Reuters', 'Meta', 'Matthew Ponsford', 'TechCrunch', 'Ars Technica', 'Beijing', 'New Yorker $', 'The Checkup', 'US', 'Argentina', '+ Technology']",2,#0000ff,120.7792207792208,151.94805194805198,p_4
End of life decisions are difficult and distressing. Could AI help?,https://www.technologyreview.com/2024/08/01/1095551/end-of-life-decisions-ai-help/,2024,"['Ben Taub Hospital', 'AI', 'Jennifer Blumenthal-Barby', 'Ethicists', 'the University of Oxford', 'Vasiliki Rahimzadeh', 'the US National Institutes of Health', 'David Wendler', 'MIT Technology Review', 'Bryanna Moore', 'Houston', 'Texas', 'Baylor College of Medicine', 'the University of Rochester', 'Holland Kaplan', 'Brian Earp', 'Jiankui', 'Earp', 'Blumenthal-Barby', 'Sophie', 'Georg Starke', 'the Swiss Federal Institute of Technology Lausanne', 'US', 'P4', 'Facebook']",2,#0000ff,640.2597402597406,629.8701298701302,-1
"The Download: AI’s end of life decisions, and green investing",https://www.technologyreview.com/2024/08/01/1095559/the-download-ais-end-of-life-decisions-and-green-investing/,2024,"['Vox', 'Congress', 'Nik Shevchenko', 'Guardian', 'Jessica Hamzelou', 'Google', 'Kamala Harris', 'Spark', 'Candy Crush', 'Verge', 'the US National Institutes of Health', 'China', 'Casey Crownhart', 'David Wendler', 'Japan', 'Jane Lytvynenko', 'MIT Technology Review', 'James Temple', 'Starliner', 'Reuters', 'Nvidia', 'Meta', 'Rest of World', 'Microsoft', 'Adobe', 'Google Search', 'friend.com', 'Ars Technica', 'Ridley Scott', 'Gigascale Capital', 'US', 'Donald Trump', 'NBC News', 'Mike Schroepfer']",2,#0000ff,131.1688311688312,162.33766233766238,p_4
Reimagining cloud strategy for AI-first enterprises,https://www.technologyreview.com/2024/07/31/1094228/reimagining-cloud-strategy-for-ai-first-enterprises/,2024,"['withInfosys', 'Infosys', 'MIT Technology Review Insights', 'ChatGPT', 'AI', 'Insights', 'Balakrishna D.R.', 'OpenAI', 'Google DeepMind', 'Bali', 'MIT Technology Review']",2,#0000ff,681.8181818181822,567.5324675324679,p_10
